{
  "$schema": "./activation.schema.json",
  "kind": "ActivationPlan",
  "catalog_version": "1.0.0",
  "activation_defaults": {
    "object_type": "ActivationPlan",
    "human_readable_summary": "Dandelion maps the territory. Admins approve the map. Foundation governs what can happen inside the map. DMWs scope what can be remembered. Stage F Activation walks an approved envelope into the live operating state — every step is human-authorized, audit-emitted, and reversible by construction.",
    "model_usage_notes": "Activation plans are DESIGN_NOT_EXECUTED. Real activation requires a future implementation slice that consumes this catalog. Every step in the catalog is the canonical projection a future runtime activation engine will follow.",
    "scope_defaults": ["TENANT_SCOPED", "ENVELOPE_SCOPED", "STEP_SCOPED"],
    "permission_defaults": ["HUMAN_AUTHORIZED_AT_EVERY_GATE", "AUDIT_EMITTED_BEFORE_AND_AFTER", "REVERSIBLE_BY_CONSTRUCTION", "NO_AUTONOMOUS_ACTIVATION"],
    "provenance": {
      "authored_by": "NIOV Labs / niov-foundation",
      "source": "docs/dandelion-activation/starter-pilot-activation.json",
      "version_tag": "d6-v1.0.0",
      "captured_at": "2026-06-01",
      "authority": "[FOUNDATION-D6-DANDELION-ACTIVATION]"
    },
    "audit_expectations": ["ADMIN_ACTION:ACTIVATION_PLAN_REFERENCED when consumed", "future ADMIN_ACTION:STARTER_ENVELOPE_ACTIVATED + per-step audit literals at the implementation slice"],
    "policy_purpose": "ACTIVATION_DESIGN_REFERENCE_ONLY",
    "allowed_consumers": ["DANDELION_ACTIVATION_ENGINE", "ADMIN_TWIN_SCOPED_TO_ORG", "CONTROL_TOWER_ADMIN_REVIEW", "FOUNDATION_GOVERNANCE_TIER"],
    "forbidden_consumers": ["AGENT_TWIN_AUTONOMOUS_ACTIVATION", "AGENT_TWIN_CROSS_TENANT", "MANAGER_SURVEILLANCE_TOOL", "EMPLOYEE_SCORING_TOOL", "EXTERNAL_THIRD_PARTY_UNAUTHORIZED"],
    "sensitivity_level": "CRITICAL"
  },
  "activation_plan": {
    "id": "activation.starter-pilot.v1",
    "version": "1",
    "status": "ACCEPTED",
    "object_type": "ActivationPlan",
    "plan_archetype_id": "starter-pilot",
    "name": "Starter / Pilot Activation Plan",
    "description": "Canonical ordered sequence to activate the Starter / Pilot Starter Envelope (envelope.starter-pilot.v1). Walks the smallest viable envelope at the Foundation runtime tier — baseline DMW grants + safe-fallback aha moments + Stage 1 template-only workflows + pilot-department-scoped role assignments. NO connector binding registration (Starter / Pilot ledger does not include connector pack entitlement). NO Stage 2+ workflow runtime. Every step is human-authorized and audit-emitted.",
    "human_readable_summary": "Smallest viable activation: open baseline DMW, register safe-fallback aha moments, assign template roles to admin + 2 standard twin seats. No connectors. No workflow execution. Every step reversible via soft-delete.",
    "model_usage_notes": "Use this plan for the cheapest plan tier. The activation deliberately skips connector-binding + workflow-runtime steps because the Starter / Pilot ledger (B4) does not include those capability pack entitlements. The plan encodes 'activate the minimum viable map; everything else stays DRAFT_NOT_ACTIVATED'.",
    "source_adr_refs": ["ADR-0082", "ADR-0080", "ADR-0083", "ADR-0001", "ADR-0027", "ADR-0002", "ADR-0026", "RULE 0", "RULE 4", "RULE 10"],
    "consumes_starter_envelope_id": "envelope.starter-pilot.v1",
    "activation_steps": [
      {
        "step_order": 1,
        "step_id": "step.precheck.envelope-state",
        "step_name": "Precondition check: envelope in DRAFT_NOT_ACTIVATED state",
        "step_purpose": "Verify the consumed Starter Envelope has not been previously activated and that the org_entity_id has admin capabilities (can_admin_org) at the caller tier.",
        "consumes_map_type": "CompanyMap",
        "produces_runtime_object": "PrecheckResult (in-memory; no persistence)",
        "human_authorization_required": false,
        "audit_literal": "ADMIN_ACTION:ENVELOPE_ACTIVATION_PRECHECK",
        "preconditions": ["envelope.envelope_state == 'DRAFT_NOT_ACTIVATED'", "caller.capabilities.can_admin_org == true", "envelope.org_entity_id == caller.org_entity_id"],
        "postconditions": ["precheck_passed == true OR activation aborted with PRECHECK_FAILED"],
        "failure_mode": "ABORT_BEFORE_ANY_MUTATION",
        "rollback_path": "No-op (precheck is read-only; no mutation occurred)"
      },
      {
        "step_order": 2,
        "step_id": "step.dmw.baseline-grant",
        "step_name": "Open baseline DMW scope for org_entity_id",
        "step_purpose": "Activate the baseline DMW per ADR-0001 + the canonical 'DMW baseline always included at base' doctrine. Self-scoped memory only at this tier; no team/customer scope.",
        "consumes_map_type": "MemoryDmwMap",
        "produces_runtime_object": "DMW baseline grant (persists in capsule.wallet_id binding for org)",
        "human_authorization_required": true,
        "audit_literal": "ADMIN_ACTION:DMW_BASELINE_GRANTED",
        "preconditions": ["step 1 precheck_passed == true", "no existing DMW baseline grant for org_entity_id"],
        "postconditions": ["DMW baseline LIVE for org_entity_id with self-scoped permission_defaults"],
        "failure_mode": "ROLLBACK_TO_PRE_GRANT_STATE",
        "rollback_path": "Soft-delete the DMW baseline grant row (RULE 10); emit ADMIN_ACTION:DMW_BASELINE_REVOKED"
      },
      {
        "step_order": 3,
        "step_id": "step.role.template-assignment",
        "step_name": "Assign template roles to admin + 2 standard twin seats",
        "step_purpose": "Register Wave 2.1 DEEP role templates (e.g. Executive Assistant + Admin) scoped to the pilot department. Maps to the 1 admin + 2 standard twin seats from the B2 ledger.",
        "consumes_map_type": "RoleMap",
        "produces_runtime_object": "Role assignments (3 rows: 1 admin + 2 standard twin)",
        "human_authorization_required": true,
        "audit_literal": "ADMIN_ACTION:ROLE_TEMPLATE_ASSIGNED",
        "preconditions": ["step 2 DMW baseline LIVE", "envelope.approved_regions_bundle includes role.template-match + role.sensitive-scope-exclusion"],
        "postconditions": ["3 role assignments LIVE; sensitive-scope exclusion enforced at every assignment"],
        "failure_mode": "ROLLBACK_TO_PRE_ASSIGNMENT_STATE",
        "rollback_path": "Soft-delete each role assignment row (RULE 10); emit ADMIN_ACTION:ROLE_TEMPLATE_UNASSIGNED per row"
      },
      {
        "step_order": 4,
        "step_id": "step.workflow.template-only-register",
        "step_name": "Register Stage 1 template-only workflows",
        "step_purpose": "Register Stage 1 workflow templates (template-only; no Stage 2+ runtime). Per ADR-0081 §2.2: Stage 1 cannot execute. Templates are visible to the assigned roles; they describe but do not run.",
        "consumes_map_type": "WorkflowMap",
        "produces_runtime_object": "Workflow template registrations (registered as visible; never executed)",
        "human_authorization_required": true,
        "audit_literal": "ADMIN_ACTION:WORKFLOW_TEMPLATE_REGISTERED",
        "preconditions": ["step 3 role assignments LIVE", "envelope.approved_regions_bundle includes workflow.stage-1-templates + workflow.safe-fallback"],
        "postconditions": ["Stage 1 templates LIVE; workflow_state remains TEMPLATE_ONLY for every template"],
        "failure_mode": "ROLLBACK_TO_PRE_REGISTRATION_STATE",
        "rollback_path": "Soft-delete each workflow template row (RULE 10); emit ADMIN_ACTION:WORKFLOW_TEMPLATE_UNREGISTERED per row"
      },
      {
        "step_order": 5,
        "step_id": "step.aha.safe-fallback-register",
        "step_name": "Register safe-fallback aha moments",
        "step_purpose": "Register the safe-fallback aha-moment surface — first-week activation hints that require no connector. Pure-content; no external integration.",
        "consumes_map_type": "AhaMomentMap",
        "produces_runtime_object": "Aha-moment registrations (content-only surface)",
        "human_authorization_required": true,
        "audit_literal": "ADMIN_ACTION:AHA_MOMENT_REGISTERED",
        "preconditions": ["step 4 workflow templates LIVE", "envelope.approved_regions_bundle includes aha.safe-fallback"],
        "postconditions": ["safe-fallback aha moments visible to assigned roles"],
        "failure_mode": "ROLLBACK_TO_PRE_REGISTRATION_STATE",
        "rollback_path": "Soft-delete the aha-moment registration row (RULE 10); emit ADMIN_ACTION:AHA_MOMENT_UNREGISTERED"
      },
      {
        "step_order": 6,
        "step_id": "step.envelope.mark-activated",
        "step_name": "Mark Starter Envelope as ACTIVATED",
        "step_purpose": "Transition envelope_state from DRAFT_NOT_ACTIVATED to ACTIVATED. This is the final state-flip step; emit STARTER_ENVELOPE_ACTIVATED audit literal with full step-by-step lineage in the audit details.",
        "consumes_map_type": "CompanyMap",
        "produces_runtime_object": "Envelope state row (envelope_state: ACTIVATED)",
        "human_authorization_required": true,
        "audit_literal": "ADMIN_ACTION:STARTER_ENVELOPE_ACTIVATED",
        "preconditions": ["all preceding steps postconditions met", "no rollback in flight"],
        "postconditions": ["envelope.envelope_state == 'ACTIVATED'; activation_lineage row persisted with step-by-step audit_event_id references"],
        "failure_mode": "ROLLBACK_ALL_PRIOR_STEPS",
        "rollback_path": "If state-flip fails, walk steps 5 → 1 in reverse order calling each step's rollback_path; emit ADMIN_ACTION:STARTER_ENVELOPE_ACTIVATION_ROLLED_BACK at completion"
      }
    ],
    "audit_expectations": [
      "Every step emits exactly one audit literal BEFORE the underlying mutation per RULE 4",
      "Every rollback emits an inverse audit literal AFTER the soft-delete row update",
      "STARTER_ENVELOPE_ACTIVATED audit details include the ordered audit_event_id list from steps 1-5",